{
  "schema_version": 1,
  "command_id": "1b4c81aa-3c5f-4c14-8f9e-1c0fbe9d2c3d",
  "device_id": "2c1f2d8e-2bb7-4f58-bb6a-6c2a0f4a7a4c",
  "command_type": "set_config",
  "payload": {
    "sampling_s": 5,
    "report_interval_s": 5
  },
  "issued_ts": "2025-12-15T10:00:00Z",
  "requested_by": "a1b2c3d4-1111-2222-3333-444455556666"
}
